{
  "executionId": "60000000-0000-4000-8000-000000000001",
  "runId": "33333333-3333-4333-8333-333333333333",
  "sourceId": "11111111-1111-4111-8111-111111111111",
  "sourceVersion": "sha256:68fc3e599c5dcb5523a2d65c2d9586bfbec34d8b0dae0660659cf8b965533b13",
  "connectorId": "connectors/tabular-reader-v1",
  "connectorVersion": "1.0.0",
  "connectorCapabilityHash": "ccca6841c2a5d15058240039228b22351d60e6279bdcef5f1b78f687b7114ade",
  "authorizationScopeId": "authorized-assets",
  "policyHash": "bbbbbbbbbbbbbbbbbbbbbbbbbbbbbbbbbbbbbbbbbbbbbbbbbbbbbbbbbbbbbbbb",
  "fencingToken": 1,
  "revocationEpoch": 0,
  "assetId": "document-1",
  "inputSha256": "1111111111111111111111111111111111111111111111111111111111111111",
  "declaredMediaType": "application/octet-stream",
  "detectedMediaType": "application/example-document",
  "parserId": "isolated-document-parser",
  "parserVersion": "1.0.0",
  "parserPolicyVersion": "1.0.0",
  "limitsSource": "policy",
  "isolation": {
    "credentialAccess": false,
    "outboundNetwork": false,
    "externalReferenceResolution": false,
    "readOnlyInput": true,
    "disposableOutput": true,
    "workerIdentity": "credential-free-isolated-worker"
  },
  "limits": {
    "cpuMilliseconds": 120000,
    "memoryBytes": 1073741824,
    "inputBytes": 268435456,
    "expandedBytes": 1073741824,
    "fileCount": 10000,
    "recursionDepth": 20,
    "durationMilliseconds": 180000,
    "frames": 10000,
    "outputBytes": 268435456
  },
  "usage": {
    "cpuMilliseconds": 1000,
    "peakMemoryBytes": 67108864,
    "inputBytes": 1024,
    "expandedBytes": 4096,
    "fileCount": 1,
    "recursionDepth": 0,
    "durationMilliseconds": 1200,
    "frames": 0,
    "outputBytes": 2048
  },
  "outcome": "completed",
  "reasonCode": null,
  "coverage": 1,
  "cleanup": {
    "completed": true,
    "completedAt": "2026-01-01T00:04:02Z",
    "residualArtifactCount": 0,
    "cleanupFailureReasonCode": null,
    "retainedOutputRefs": [
      "evidence:document-1-structure"
    ]
  },
  "startedAt": "2026-01-01T00:04:00Z",
  "completedAt": "2026-01-01T00:04:02Z"
}
